{
  "schema_version": "project-blueprint.profile-manifest.v1",
  "document_role": "authoritative_profile_inventory_acceptance_and_generation_manifest",
  "permission_grant": false,
  "profiles": [
    {
      "id": "minimal",
      "rank": 0,
      "layers": [
        "core"
      ],
      "label": "Minimal",
      "selection_basis": "early_or_low_risk_project_requiring_the_complete_domain_neutral_kernel",
      "collaboration_independent": true
    },
    {
      "id": "standard",
      "rank": 1,
      "layers": [
        "core",
        "standard"
      ],
      "label": "Standard",
      "selection_basis": "structured_traceability_review_or_extension_risk",
      "collaboration_independent": true
    },
    {
      "id": "high-assurance",
      "rank": 2,
      "layers": [
        "core",
        "standard",
        "high-assurance"
      ],
      "label": "High Assurance",
      "selection_basis": "sensitive_externally_effective_audit_or_long_lived_agent_operation",
      "collaboration_independent": true
    }
  ],
  "layouts": [
    {
      "id": "compact",
      "default": true,
      "description": "Combine only conceptual artifacts whose authority, owner, lifecycle, review, sensitivity, and retention remain aligned.",
      "omit_paths": [
        "project-dossier/CANONICAL_SOURCE_MAP.md"
      ],
      "template_overrides": [
        {
          "output_path": "project-dossier/AUTHORITY.md",
          "source": "skill:assets/layouts/compact/project-dossier/AUTHORITY.md.tmpl"
        }
      ],
      "registry_combinations": [
        {
          "retained_representation_id": "REP-0002",
          "absorbed_representation_ids": ["REP-0003"],
          "artifact_type_ids": ["DOS-0002", "DOS-0003"],
          "representation_role": "combined_interpretation_and_source_map",
          "authority": "dossier_interpretation_and_source_ownership",
          "applicability_rationale": "Compact layout combines two required conceptual artifacts whose governance boundaries are aligned.",
          "owner_role": "project_governance_owner",
          "review_cadence": "on_authority_or_source_owner_change",
          "update_triggers": ["authority_change", "information_class_change", "artifact_added", "source_direction_change"]
        }
      ]
    },
    {
      "id": "separated",
      "default": false,
      "description": "Keep every Blueprint representation physically separate; use when ownership or lifecycle boundaries require it.",
      "omit_paths": [],
      "template_overrides": [],
      "registry_combinations": []
    }
  ],
  "project_paths": {
    "kernel_files": [
      ".agent/policy.json",
      ".agent/context.json",
      ".agent/schema.json",
      ".agent/lifecycle.json",
      ".agent/tools.json",
      ".agent/validators.json",
      ".agent/project.json"
    ],
    "origin": {
      "path": ".project-blueprint-origin.json",
      "ownership": "generated_snapshot_provenance"
    },
    "project_local_sources": [
      {
        "path": ".agent/state/focus.json",
        "minimum_profile": "minimal",
        "ownership": "project_owned_operator_intent_not_permission"
      },
      {
        "path": ".agent/decisions/governance-register.json",
        "minimum_profile": "minimal",
        "ownership": "project_owned_decision_question_and_review_source_not_accepted_authority"
      },
      {
        "path": "project-dossier/machine-readable/artifact-registry.json",
        "minimum_profile": "minimal",
        "ownership": "project_owned_authoritative_source"
      }
    ],
    "derived_outputs": [
      {
        "path": ".agent/state/current.json",
        "minimum_profile": "minimal",
        "writer": "refresh",
        "ownership": "fully_derived_operational_view"
      },
      {
        "path": "project-dossier/ARTIFACT_CATALOG.json",
        "minimum_profile": "minimal",
        "writer": "refresh",
        "ownership": "generated_from_artifact_registry"
      },
      {
        "path": "project-dossier/machine-readable/path-authority.json",
        "minimum_profile": "minimal",
        "writer": "refresh",
        "ownership": "generated_from_artifact_registry"
      },
      {
        "path": "project-dossier/MANIFEST.json",
        "minimum_profile": "minimal",
        "writer": "refresh",
        "ownership": "generated_integrity"
      },
      {
        "path": "project-dossier/CHECKSUMS.sha256",
        "minimum_profile": "high-assurance",
        "writer": "refresh",
        "ownership": "generated_integrity"
      },
      {
        "path": ".agent/generated/manifest.json",
        "minimum_profile": "high-assurance",
        "writer": "refresh",
        "ownership": "generated_integrity"
      },
      {
        "path": ".agent/generated/validation-report.json",
        "minimum_profile": "high-assurance",
        "writer": "refresh",
        "ownership": "generated_validation_evidence"
      }
    ],
    "operational_projection": {
      "include_exact": [
        "AGENTS.md",
        ".project-blueprint-origin.json"
      ],
      "include_subtrees": [
        ".agent",
        ".agents"
      ]
    }
  },
  "packages": [
    {
      "id": "small-team-git-portfolio",
      "kind": "scm_portfolio",
      "version": "1.1.0",
    "sha256": "9957da027a3bd940c020d3d38898e06a431e43bc2be7e086d2999506bdfafea5",
      "source": "skill:assets/packages/small-team-git-portfolio/templates",
      "inventory_paths": [
        ".agent/workflows/README.md.tmpl",
        ".agent/workflows/github-adapter.md.tmpl",
        ".agent/workflows/small-team-git.json.tmpl"
      ],
      "profiles": [
        "minimal",
        "standard",
        "high-assurance"
      ],
      "installation": "trigger_installed_transactionally",
      "trigger": "git_selected_or_explicitly_adopted",
      "permission_grant": false
    },
    {
      "id": "operations-observability",
      "kind": "domain_extension",
      "version": "1.0.0",
      "sha256": "0be04f304ccd976296f03d36996343919d7494d9acfd1dd630a0d0d28d33d9c2",
      "source": "skill:assets/packages/operations-observability/templates",
      "inventory_paths": [
        ".agent/extensions/operations-observability/README.md.tmpl",
        ".agent/extensions/operations-observability/config.json.tmpl",
        ".agent/extensions/operations-observability/config.schema.json.tmpl",
        ".agent/extensions/operations-observability/records.json.tmpl",
        ".agent/extensions/operations-observability/records.schema.json.tmpl",
        ".agent/extensions/operations-observability/tests/fixtures/authority-mutation.json.tmpl",
        ".agent/extensions/operations-observability/tests/fixtures/broken-reference.json.tmpl",
        ".agent/extensions/operations-observability/tests/fixtures/invalid.json.tmpl",
        ".agent/extensions/operations-observability/tests/fixtures/stale-evidence.json.tmpl",
        ".agent/extensions/operations-observability/tests/fixtures/valid.json.tmpl",
        ".agent/extensions/operations-observability/tests/test_validate.py.tmpl",
        ".agent/extensions/operations-observability/validate.py.tmpl"
      ],
      "profiles": [
        "minimal",
        "standard",
        "high-assurance"
      ],
      "installation": "trigger_installed_transactionally",
      "trigger": "operations_or_observability_risk_applies",
      "permission_grant": false
    },
    {
      "id": "security-supply-chain",
      "kind": "domain_extension",
      "version": "1.0.0",
      "sha256": "879a36d0c73932fa27f49573180b3287c2dacda426a2f319dcd13204c53c7022",
      "source": "skill:assets/packages/security-supply-chain/templates",
      "inventory_paths": [
        ".agent/extensions/security-supply-chain/README.md.tmpl",
        ".agent/extensions/security-supply-chain/config.json.tmpl",
        ".agent/extensions/security-supply-chain/config.schema.json.tmpl",
        ".agent/extensions/security-supply-chain/records.json.tmpl",
        ".agent/extensions/security-supply-chain/records.schema.json.tmpl",
        ".agent/extensions/security-supply-chain/tests/fixtures/authority-mutation.json.tmpl",
        ".agent/extensions/security-supply-chain/tests/fixtures/broken-reference.json.tmpl",
        ".agent/extensions/security-supply-chain/tests/fixtures/invalid.json.tmpl",
        ".agent/extensions/security-supply-chain/tests/fixtures/stale-evidence.json.tmpl",
        ".agent/extensions/security-supply-chain/tests/fixtures/valid.json.tmpl",
        ".agent/extensions/security-supply-chain/tests/test_validate.py.tmpl",
        ".agent/extensions/security-supply-chain/validate.py.tmpl"
      ],
      "profiles": [
        "minimal",
        "standard",
        "high-assurance"
      ],
      "installation": "trigger_installed_transactionally",
      "trigger": "security_or_supply_chain_risk_applies",
      "permission_grant": false
    },
    {
      "id": "sample-restriction",
      "kind": "reference_extension",
      "version": "1.0.0",
      "sha256": "fd4ea8c3dbd2608f786260bfdd0c59a96460fcd0d5c3fead422210897567a788",
      "source": "skill:assets/packages/sample-restriction/templates",
      "inventory_paths": [
        ".agent/extensions/sample-restriction/README.md.tmpl",
        ".agent/extensions/sample-restriction/config.json.tmpl",
        ".agent/extensions/sample-restriction/validate.py.tmpl"
      ],
      "profiles": [
        "high-assurance"
      ],
      "installation": "trigger_installed_transactionally",
      "trigger": "reference_extension_validation",
      "permission_grant": false
    },
    {
      "id": "context-pack-schema",
      "kind": "optional_schema",
      "version": "1.0.0",
      "sha256": "ba3120024546950b3a15741326fa9ab2fd1ec8241927b823a055193f0e74f039",
      "source": "blueprint:shared/optional-schemas",
      "inventory_paths": ["context-pack-manifest.schema.json"],
      "profiles": [
        "high-assurance"
      ],
      "installation": "trigger_installed_transactionally",